{
  "packId": "peak",
  "version": "1.0.0",
  "schemaVersion": 1,
  "rulesetId": "synthetic-v2",
  "verification": "UNVERIFIED",
  "license": {
    "identifier": "CC0-1.0",
    "public": true
  },
  "files": {
    "units": "units.json",
    "moves": "moves.json",
    "seals": "../seals/seals.json",
    "soulmarks": "soulmarks.json",
    "items": "../synthetic-v2/items.json"
  },
  "assets": []
}
